qid,query,nuggets,supported_nuggets,partially_supported_nuggets,nuggets_metrics
2506.00382v1,"Write a Related Works section for an academic paper given the paper's abstract. Here is the paper abstract:
Understanding how feature representations evolve across layers in large
language models (LLMs) is key to improving their interpretability and
robustness. While recent studies have identified critical layers linked to
specific functions or behaviors, these efforts typically rely on data-dependent
analyses of fine-tuned models, limiting their use to post-hoc settings. In
contrast, we introduce a data-oblivious approach to identify intrinsic critical
layers in pre-fine-tuned LLMs by analyzing representation dynamics via Centered
Kernel Alignment(CKA). We show that layers with significant shifts in
representation space are also those most affected during fine-tuning--a pattern
that holds consistently across tasks for a given model. Our spectral analysis
further reveals that these shifts are driven by changes in the top principal
components, which encode semantic transitions from rationales to conclusions.
We further apply these findings to two practical scenarios: efficient domain
adaptation, where fine-tuning critical layers leads to greater loss reduction
compared to non-critical layers; and backdoor defense, where freezing them
reduces attack success rates by up to 40%.","[{'text': 'CKA and SVCCA compare neural network layer representations', 'importance': 'vital', 'assignment': 'support'}, {'text': 'Fine-tuning impacts CKA similarity patterns across LLM layers', 'importance': 'vital', 'assignment': 'support'}, {'text': 'Representation similarity metrics explore LLM generalization', 'importance': 'vital', 'assignment': 'support'}, {'text': 'Layer representations evolve and contribute to LLM predictions', 'importance': 'vital', 'assignment': 'support'}, {'text': 'Some layers show substantial representation space changes', 'importance': 'vital', 'assignment': 'support'}, {'text': 'Spectral analysis links principal components to semantic transitions', 'importance': 'vital', 'assignment': 'support'}, {'text': 'CCA, SVCCA, and CKA reveal learning dynamics in neural networks', 'importance': 'okay', 'assignment': 'support'}, {'text': 'Representation consistency improves classification performance', 'importance': 'okay', 'assignment': 'support'}, {'text': 'Contiguous hidden layers can have highly similar representations', 'importance': 'okay', 'assignment': 'support'}, {'text': 'Activation similarity reveals convergence dynamics during pre-training', 'importance': 'okay', 'assignment': 'support'}, {'text': 'Middle layers encode factual information in LLMs', 'importance': 'okay', 'assignment': 'support'}, {'text': 'Mid-depth layers capture features for trustworthy responses', 'importance': 'okay', 'assignment': 'support'}, {'text': 'Specific layers correlate with safety-related behaviors', 'importance': 'okay', 'assignment': 'support'}, {'text': 'Concepts emerge across layers from a concept learning perspective', 'importance': 'okay', 'assignment': 'support'}, {'text': 'Activation quality metrics provide insight into internal evaluations', 'importance': 'okay', 'assignment': 'support'}]","[{'text': 'CKA and SVCCA compare neural network layer representations', 'importance': 'vital', 'assignment': 'support'}, {'text': 'Fine-tuning impacts CKA similarity patterns across LLM layers', 'importance': 'vital', 'assignment': 'support'}, {'text': 'Representation similarity metrics explore LLM generalization', 'importance': 'vital', 'assignment': 'support'}, {'text': 'Layer representations evolve and contribute to LLM predictions', 'importance': 'vital', 'assignment': 'support'}, {'text': 'Some layers show substantial representation space changes', 'importance': 'vital', 'assignment': 'support'}, {'text': 'Spectral analysis links principal components to semantic transitions', 'importance': 'vital', 'assignment': 'support'}, {'text': 'CCA, SVCCA, and CKA reveal learning dynamics in neural networks', 'importance': 'okay', 'assignment': 'support'}, {'text': 'Representation consistency improves classification performance', 'importance': 'okay', 'assignment': 'support'}, {'text': 'Contiguous hidden layers can have highly similar representations', 'importance': 'okay', 'assignment': 'support'}, {'text': 'Activation similarity reveals convergence dynamics during pre-training', 'importance': 'okay', 'assignment': 'support'}, {'text': 'Middle layers encode factual information in LLMs', 'importance': 'okay', 'assignment': 'support'}, {'text': 'Mid-depth layers capture features for trustworthy responses', 'importance': 'okay', 'assignment': 'support'}, {'text': 'Specific layers correlate with safety-related behaviors', 'importance': 'okay', 'assignment': 'support'}, {'text': 'Concepts emerge across layers from a concept learning perspective', 'importance': 'okay', 'assignment': 'support'}, {'text': 'Activation quality metrics provide insight into internal evaluations', 'importance': 'okay', 'assignment': 'support'}]","[{'text': 'CKA and SVCCA compare neural network layer representations', 'importance': 'vital', 'assignment': 'support'}, {'text': 'Fine-tuning impacts CKA similarity patterns across LLM layers', 'importance': 'vital', 'assignment': 'support'}, {'text': 'Representation similarity metrics explore LLM generalization', 'importance': 'vital', 'assignment': 'support'}, {'text': 'Layer representations evolve and contribute to LLM predictions', 'importance': 'vital', 'assignment': 'support'}, {'text': 'Some layers show substantial representation space changes', 'importance': 'vital', 'assignment': 'support'}, {'text': 'Spectral analysis links principal components to semantic transitions', 'importance': 'vital', 'assignment': 'support'}, {'text': 'CCA, SVCCA, and CKA reveal learning dynamics in neural networks', 'importance': 'okay', 'assignment': 'support'}, {'text': 'Representation consistency improves classification performance', 'importance': 'okay', 'assignment': 'support'}, {'text': 'Contiguous hidden layers can have highly similar representations', 'importance': 'okay', 'assignment': 'support'}, {'text': 'Activation similarity reveals convergence dynamics during pre-training', 'importance': 'okay', 'assignment': 'support'}, {'text': 'Middle layers encode factual information in LLMs', 'importance': 'okay', 'assignment': 'support'}, {'text': 'Mid-depth layers capture features for trustworthy responses', 'importance': 'okay', 'assignment': 'support'}, {'text': 'Specific layers correlate with safety-related behaviors', 'importance': 'okay', 'assignment': 'support'}, {'text': 'Concepts emerge across layers from a concept learning perspective', 'importance': 'okay', 'assignment': 'support'}, {'text': 'Activation quality metrics provide insight into internal evaluations', 'importance': 'okay', 'assignment': 'support'}]","{'strict_vital_score': 1.0, 'strict_all_score': 1.0, 'vital_score': 1.0, 'all_score': 1.0}"
