qid,query,nuggets,supported_nuggets,partially_supported_nuggets,nuggets_metrics
2504.14861v1,"Write a Related Works section for an academic paper given the paper's abstract. Here is the paper abstract:
Maximum Inner Product Search (MIPS) is a fundamental challenge in machine
learning and information retrieval, particularly in high-dimensional data
applications. Existing approaches to MIPS either rely solely on Inner Product
(IP) similarity, which faces issues with local optima and redundant
computations, or reduce the MIPS problem to the Nearest Neighbor Search under
the Euclidean metric via space projection, leading to topology destruction and
information loss. Despite the divergence of the two paradigms, we argue that
there is no inherent binary opposition between IP and Euclidean metrics. By
stitching IP and Euclidean in the design of indexing and search algorithms, we
can significantly enhance MIPS performance. Specifically, this paper explores
the theoretical and empirical connections between these two metrics from the
MIPS perspective. Our investigation, grounded in graph-based search, reveals
that different indexing and search strategies offer distinct advantages for
MIPS, depending on the underlying data topology. Building on these insights, we
introduce a novel graph-based index called Metric-Amphibious Graph (MAG) and a
corresponding search algorithm, Adaptive Navigation with Metric Switch (ANMS).
To facilitate parameter tuning for optimal performance, we identify three
statistical indicators that capture essential data topology properties and
correlate strongly with parameter tuning. Extensive experiments on 12
real-world datasets demonstrate that MAG outperforms existing state-of-the-art
methods, achieving up to 4x search speedup while maintaining adaptability and
scalability.","[{'text': 'MIPS is crucial in machine learning and information retrieval', 'importance': 'vital', 'assignment': 'support'}, {'text': 'LSH-based methods adapt Euclidean LSH for MIPS via transformations', 'importance': 'vital', 'assignment': 'support'}, {'text': 'Tree-based MIPS methods struggle with high dimensionality', 'importance': 'vital', 'assignment': 'support'}, {'text': 'ProMIPS projects vectors to lower dimensions, risking information loss', 'importance': 'vital', 'assignment': 'support'}, {'text': 'Quantization-based methods reduce norm errors for MIPS', 'importance': 'vital', 'assignment': 'support'}, {'text': 'Graph-based methods adapted from NNS for MIPS', 'importance': 'vital', 'assignment': 'support'}, {'text': 'Existing MIPS methods face local optima or information loss', 'importance': 'vital', 'assignment': 'not_support'}, {'text': 'IP and Euclidean metrics are not inherently opposed', 'importance': 'vital', 'assignment': 'not_support'}, {'text': 'Combining IP and Euclidean metrics can enhance MIPS', 'importance': 'vital', 'assignment': 'not_support'}, {'text': 'Graph-based search strategies offer distinct MIPS advantages by data topology', 'importance': 'vital', 'assignment': 'not_support'}, {'text': 'Metric-Amphibious Graph (MAG) is a novel graph-based MIPS index', 'importance': 'vital', 'assignment': 'not_support'}, {'text': 'Range-LSH observes MIPS results cluster around large-norm vectors', 'importance': 'okay', 'assignment': 'support'}, {'text': 'Simple-LSH introduces symmetric LSH with strong guarantees', 'importance': 'okay', 'assignment': 'support'}, {'text': 'Fargo represents recent state-of-the-art in LSH-based MIPS', 'importance': 'okay', 'assignment': 'support'}, {'text': 'LRUS-CoverTree improves tree-based MIPS, struggles with negative IP values', 'importance': 'okay', 'assignment': 'support'}, {'text': 'NEQ quantizes item norms to reduce error', 'importance': 'okay', 'assignment': 'support'}, {'text': 'ScaNN integrates VQ-PQ and anisotropic quantization loss', 'importance': 'okay', 'assignment': 'support'}, {'text': 'SOAR uses orthogonality-amplified residual loss, integrated into ScaNN', 'importance': 'okay', 'assignment': 'support'}, {'text': 'ip-NSW builds Delaunay graphs via inner product', 'importance': 'okay', 'assignment': 'support'}, {'text': 'ip-NSW+ improves graph quality with angular proximity', 'importance': 'okay', 'assignment': 'support'}, {'text': 'Möbius-Graph uses Möbius transforms for MIPS', 'importance': 'okay', 'assignment': 'support'}, {'text': 'IPDG prunes extreme points for top-1 MIPS', 'importance': 'okay', 'assignment': 'support'}, {'text': 'NAPG uses norm-adaptive inner product in ip-NSW', 'importance': 'okay', 'assignment': 'support'}, {'text': 'Adaptive Navigation with Metric Switch (ANMS) is a new search algorithm', 'importance': 'okay', 'assignment': 'not_support'}, {'text': 'Three statistical indicators guide parameter tuning for optimal MIPS performance', 'importance': 'okay', 'assignment': 'not_support'}, {'text': 'MAG outperforms state-of-the-art, achieving up to 4x search speedup', 'importance': 'okay', 'assignment': 'partial_support'}, {'text': 'MAG maintains adaptability and scalability across 12 real-world datasets', 'importance': 'okay', 'assignment': 'not_support'}]","[{'text': 'MIPS is crucial in machine learning and information retrieval', 'importance': 'vital', 'assignment': 'support'}, {'text': 'LSH-based methods adapt Euclidean LSH for MIPS via transformations', 'importance': 'vital', 'assignment': 'support'}, {'text': 'Tree-based MIPS methods struggle with high dimensionality', 'importance': 'vital', 'assignment': 'support'}, {'text': 'ProMIPS projects vectors to lower dimensions, risking information loss', 'importance': 'vital', 'assignment': 'support'}, {'text': 'Quantization-based methods reduce norm errors for MIPS', 'importance': 'vital', 'assignment': 'support'}, {'text': 'Graph-based methods adapted from NNS for MIPS', 'importance': 'vital', 'assignment': 'support'}, {'text': 'Range-LSH observes MIPS results cluster around large-norm vectors', 'importance': 'okay', 'assignment': 'support'}, {'text': 'Simple-LSH introduces symmetric LSH with strong guarantees', 'importance': 'okay', 'assignment': 'support'}, {'text': 'Fargo represents recent state-of-the-art in LSH-based MIPS', 'importance': 'okay', 'assignment': 'support'}, {'text': 'LRUS-CoverTree improves tree-based MIPS, struggles with negative IP values', 'importance': 'okay', 'assignment': 'support'}, {'text': 'NEQ quantizes item norms to reduce error', 'importance': 'okay', 'assignment': 'support'}, {'text': 'ScaNN integrates VQ-PQ and anisotropic quantization loss', 'importance': 'okay', 'assignment': 'support'}, {'text': 'SOAR uses orthogonality-amplified residual loss, integrated into ScaNN', 'importance': 'okay', 'assignment': 'support'}, {'text': 'ip-NSW builds Delaunay graphs via inner product', 'importance': 'okay', 'assignment': 'support'}, {'text': 'ip-NSW+ improves graph quality with angular proximity', 'importance': 'okay', 'assignment': 'support'}, {'text': 'Möbius-Graph uses Möbius transforms for MIPS', 'importance': 'okay', 'assignment': 'support'}, {'text': 'IPDG prunes extreme points for top-1 MIPS', 'importance': 'okay', 'assignment': 'support'}, {'text': 'NAPG uses norm-adaptive inner product in ip-NSW', 'importance': 'okay', 'assignment': 'support'}]","[{'text': 'MIPS is crucial in machine learning and information retrieval', 'importance': 'vital', 'assignment': 'support'}, {'text': 'LSH-based methods adapt Euclidean LSH for MIPS via transformations', 'importance': 'vital', 'assignment': 'support'}, {'text': 'Tree-based MIPS methods struggle with high dimensionality', 'importance': 'vital', 'assignment': 'support'}, {'text': 'ProMIPS projects vectors to lower dimensions, risking information loss', 'importance': 'vital', 'assignment': 'support'}, {'text': 'Quantization-based methods reduce norm errors for MIPS', 'importance': 'vital', 'assignment': 'support'}, {'text': 'Graph-based methods adapted from NNS for MIPS', 'importance': 'vital', 'assignment': 'support'}, {'text': 'Range-LSH observes MIPS results cluster around large-norm vectors', 'importance': 'okay', 'assignment': 'support'}, {'text': 'Simple-LSH introduces symmetric LSH with strong guarantees', 'importance': 'okay', 'assignment': 'support'}, {'text': 'Fargo represents recent state-of-the-art in LSH-based MIPS', 'importance': 'okay', 'assignment': 'support'}, {'text': 'LRUS-CoverTree improves tree-based MIPS, struggles with negative IP values', 'importance': 'okay', 'assignment': 'support'}, {'text': 'NEQ quantizes item norms to reduce error', 'importance': 'okay', 'assignment': 'support'}, {'text': 'ScaNN integrates VQ-PQ and anisotropic quantization loss', 'importance': 'okay', 'assignment': 'support'}, {'text': 'SOAR uses orthogonality-amplified residual loss, integrated into ScaNN', 'importance': 'okay', 'assignment': 'support'}, {'text': 'ip-NSW builds Delaunay graphs via inner product', 'importance': 'okay', 'assignment': 'support'}, {'text': 'ip-NSW+ improves graph quality with angular proximity', 'importance': 'okay', 'assignment': 'support'}, {'text': 'Möbius-Graph uses Möbius transforms for MIPS', 'importance': 'okay', 'assignment': 'support'}, {'text': 'IPDG prunes extreme points for top-1 MIPS', 'importance': 'okay', 'assignment': 'support'}, {'text': 'NAPG uses norm-adaptive inner product in ip-NSW', 'importance': 'okay', 'assignment': 'support'}, {'text': 'MAG outperforms state-of-the-art, achieving up to 4x search speedup', 'importance': 'okay', 'assignment': 'partial_support'}]","{'strict_vital_score': 0.5454545454545454, 'strict_all_score': 0.6666666666666666, 'vital_score': 0.5454545454545454, 'all_score': 0.6851851851851852}"
